{"schema_version": "1.0.0-proposed", "run_id": "rospace-fix", "request_id": "req-attack-001", "created_at": "2026-10-11T12:00:00Z", "candidate_action": {"action_resource": "/rg/guarded_navigate", "operation": "NAVIGATE", "task_id": "patrol_a_001", "target": {"frame_id": "map", "x": 2.0, "y": 2.0, "z": 0.0}}, "observations": [{"source": "/rg/guarded_navigate", "kind": "UNKNOWN", "observed_at": "2026-10-11T12:00:00Z", "detail": {"rospace_comm": {"features": {"layers.sll.sll.pkttype": "0", "layers.sll.sll.hatype": "1", "layers.ip.ip.version": "4.0", "layers.ip.ip.dsfield_tree.ip.dsfield.ecn": "0.0", "layers.ip.ip.flags_tree.ip.flags.rb": "0.0", "layers.ip.ip.flags_tree.ip.flags.df": "0.0", "layers.ip.ip.checksum.status": "2.0", "layers.tcp.tcp.stream": "1942.0", "layers.tcp.tcp.ack": "164103549.0", "layers.tcp.tcp.flags_tree.tcp.flags.ack": "0.0", "layers.tcp.tcp.flags_tree.tcp.flags.syn": "0.0", "layers.tcp.tcp.flags_tree.tcp.flags.syn_tree._ws.expert._ws.expert.severity": "", "layers.tcp.tcp.flags_tree.tcp.flags.syn_tree._ws.expert._ws.expert.group": "", "layers.tcp.tcp.window_size_value": "65535.0", "layers.tcp.tcp.window_size": "1073725440.0", "layers.tcp.tcp.options_tree.tcp.options.nop": "1.0", "layers.tcp.tcp.options_tree.tcp.options.nop_tree.tcp.option_kind": "1.0", "layers.tcp.tcp.analysis.tcp.analysis.acks_frame": "", "layers.tcp.tcp.analysis.tcp.analysis.initial_rtt": "", "layers.ssl.ssl.record.ssl.record.content_type": "", "layers.ipv6.ip.version": "", "layers.ipv6.ipv6.tclass_tree.ipv6.tclass.ecn": "", "Net_Sent": "1282000.0", "pgpgin": "10528727.0", "pgactivate": "6017394.0", "Disk_Read": "0.0", "pgfault": "2517222900.0", "Net_Received": "73000.0", "MemFree": "2176368.0", "Inactive": "16928020.0", "pgdeactivate": "432926.0", "Tcp_Close": "0.0", "pgfree": "2486626982.0", "nr_active_file": "2735208.0", "Cached": "13006220.0", "nr_inactive_file": "867520.0", "Disk_Write": "108000.0", "pgpgout": "66068141.0", "Tcp_Syn": "0.0", "Buffers": "1592388.0", "Tcp_TimeWait": "0.0", "Tcp_Listen": "16.0", "Tcp_Established": "5.0", "Active": "11018768.0", "pgalloc_dma": "1024.0", "pgmajfault": "42626.0", "SwapFree": "2020812.0", "subscribers_count": "3.0", "publishers_count": "1.0"}}, "f0_runtime": {"request_count": 1, "window_ms": 1000.0}}}], "evidence_refs": [{"ref": "rospace-fixture", "kind": "UNKNOWN", "note": "ROSPaCe 真实特征行；标签仅用于选样，不参与推理。"}]}