{
  "schema_version": "1.0.0-proposed",
  "run_id": "run-m2-lab",
  "request_id": "req-lab-p01",
  "created_at": "2026-10-22T03:23:45Z",
  "candidate_action": {
    "action_resource": "/rg/guarded_navigate",
    "operation": "NAVIGATE",
    "task_id": "patrol_a_001",
    "target": {
      "frame_id": "map",
      "x": 1.5,
      "y": 1.5,
      "z": 0.0
    }
  },
  "observations": [
    {
      "source": "security",
      "kind": "UNKNOWN",
      "observed_at": "2026-10-22T03:23:45Z"
    }
  ],
  "evidence_refs": [
    {
      "ref": "tests/integration/m2_lab_identity_chain.py",
      "kind": "CONTROLLED_SECURITY_EXPERIMENT"
    }
  ]
}