{"schema_version": "1.0.0-proposed", "run_id": "run-gateway-lab", "request_id": "req-gw-lab-001", "created_at": "2026-10-21T17:47:33Z", "candidate_action": {"action_resource": "/rg/guarded_navigate", "operation": "NAVIGATE", "task_id": "patrol_a_001", "target": {"frame_id": "map", "x": 1.5, "y": 1.5, "z": 0.0}}, "observations": [{"source": "security", "kind": "UNKNOWN", "observed_at": "2026-10-21T17:47:33Z"}], "evidence_refs": [{"ref": "tests/integration/gateway_identity_lab.py", "kind": "CONTROLLED_SECURITY_EXPERIMENT"}]}