{
  "schema_version": "1.0.0-proposed",
  "run_id": "controlled-unit-run",
  "request_id": "req-unit",
  "created_at": "2026-10-13T12:00:05Z",
  "candidate_action": {
    "action_resource": "/rg/guarded_navigate",
    "operation": "NAVIGATE",
    "task_id": "patrol_a_001",
    "target": {
      "frame_id": "map",
      "x": 2,
      "y": 2
    }
  },
  "observations": [
    {
      "source": "/rg/guarded_navigate",
      "kind": "MOCK",
      "observed_at": "2026-10-13T12:00:05Z",
      "detail": {
        "f0_runtime": {
          "communication": {
            "resource": "/rg/guarded_navigate",
            "resource_type": "Action",
            "operation": "GOAL_SEND"
          },
          "request_count": 10,
          "window": {
            "start": "2026-10-13T12:00:00Z",
            "end": "2026-10-13T12:00:05Z",
            "duration_ms": 5000
          }
        }
      }
    }
  ],
  "evidence_refs": [
    {
      "ref": "modules/my_comm/test_module.py#envelope",
      "kind": "MOCK",
      "note": "synthetic controlled input; not actual ROS traffic"
    }
  ]
}